{
  "version": "1.0.0",
  "generated_at": "2025-12-09T00:00:00Z",
  "description": "Minimal sample instrument catalog",
  "categories": ["keys", "synth", "drums", "strings", "percussion", "brass"],
  "instruments": [
    {
      "id": "piano",
      "name": "Acoustic Piano",
      "category": "keys",
      "presets": ["grand", "bright"],
      "fallback_rules": [],
      "sample_references": [],
      "polyphony_limit": 16,
      "range": "A0-C8"
    },
    {
      "id": "synth-pad",
      "name": "Synth Pad",
      "category": "synth",
      "presets": ["warm", "ambient"],
      "fallback_rules": [],
      "sample_references": [],
      "polyphony_limit": 8,
      "range": "C2-C6"
    },
    {
      "id": "guitar_acoustic",
      "name": "Acoustic Guitar",
      "category": "strings",
      "presets": ["strum", "fingerpicking"],
      "fallback_rules": [],
      "sample_references": [],
      "polyphony_limit": 6,
      "range": "E2-E6"
    },
    {
      "id": "violin",
      "name": "Violin",
      "category": "strings",
      "presets": ["solo", "legato"],
      "fallback_rules": [],
      "sample_references": [],
      "polyphony_limit": 1,
      "range": "G3-A7"
    }
  ]
}
